{
  "id": "HD-REPOSITORY-READ-ONLY-001",
  "statement": "Read-only inspection may not create, modify, delete, publish, or transmit repository content.",
  "level": "MUST",
  "scope": {
    "repositories": ["*"],
    "tasks": ["inspection"],
    "roles": ["agent"],
    "files": ["*"],
    "tools": ["read-only"],
    "environments": ["local"]
  },
  "authority": {
    "source": "repository doctrine",
    "level": "repository"
  },
  "precedence": {
    "authorityRank": 3,
    "priority": 100,
    "tieBreaker": "narrower-scope"
  },
  "rationale": "Preserve review boundaries and prevent unintended effects.",
  "exceptions": [
    {
      "condition": "The user explicitly authorizes a scoped local write.",
      "disposition": "requires-approval"
    }
  ],
  "evidence": {
    "requirements": ["command summary", "changed-paths report when an exception is used"],
    "retention": "report"
  },
  "owner": {
    "role": "repository maintainer",
    "reviewer": "policy owner"
  },
  "review": {
    "trigger": "Review after a relevant policy conflict or annually.",
    "dueOn": "2027-08-01"
  },
  "expiry": {
    "expiresOn": "2028-08-01",
    "action": "review"
  }
}
